,app,description,image,logo
22,com.sec.android.app.shealth,"Samsung Health provides core features to keep up your body fit and healthy. It will record and analyze your daily activities and habits to help maintain successful diet and lead healthy lifestyle.Whether you walk or run, hike or bike, play indoor or outdoor sports, you can add and track the various physical exercises and activities in a single step using the various built-in trackers.Samsung Health helps to create a balanced lifestyle pattern by recording a variety of information like your food, caffeine and water intake details.Provide your daily snacks, food, water and caffeine intake and track your diet and weight on the go while staying comfortable using the sleep & stress tracker.Manage health and environmental records such as heart rate, blood pressure, blood glucose levels, stress, weight & SpO₂ using built-in sensors and third party devices.Trackers enable user to easily and quickly check meaningful data based on user preferences. The intuitive charts, helpful tips and physical exercise programs guide you to achieve your fitness and diet goals.Manage your fitness activities, track your weight and monitor your diet using Samsung Galaxy and Gear devices.The App supports all Samsung smartphones starting from Galaxy S3 onwards and includes Non-Samsung Android smartphones as well.Exercise programs such as Baby steps to 5K, Run 5K and so on are available to take your running to the next level and you will be guided via voice prompts during workout.Compete with your friends and check your ranking. You can compete with your friends in the address box once your Samsung account is registered.Check daily health news of your preference with customized news feed. Keep your body strong and healthy with tips offered by health professionals.Discover the best health and fitness apps that can connect with Samsung Health. Many health apps including 'Technogym' and 'Coach by Cigna' can be linked with Samsung Health.Tablets and some mobile devices may not be supported. Some functions may not be available based on regions/service providers/devices. Samsung Health requires Android OS 4.4 or above.Samsung Health supports over 70 languages, including English, French, and Chinese. An English language version is available for the rest of the world.Please note that Samsung Health is intended for fitness and wellness purposes only and is not intended for use in the diagnosis of disease or other conditions, or in the cure, mitigation, treatment, or prevention of disease.Samsung Health protects your private health data securely. All Samsung Galaxy models released after August 2016, Knox enabled Samsung Health service will be available. Please be noted that Knox enabled Samsung Health service will not be available from rooted mobile.The following permissions are required for the app service. For  optional permissions, the default functionality of the service is turned on,  but not allowed.Required permissions• NoneOptional permissions• Telephone: Used to check device-unique identification information for providing app update and app analysis information• Camera: Used for barcode recognition, food photography, and recognition  of blood glucose meter and blood pressure meter• Microphone: Used to provide recording function for telemedicine• Location: Used to check the movement path and movement of the user during  exercise• Contacts: Used to make friends when using Together function as contact  information• Body sensors: Used to measure heart rate, oxygen saturation, and  stress• SMS: Used for phone number authentication when using Together  function• Storage: Used to save or load exercise information, exercise photos or food photosIf your system software version is lower than Android 6.0, please update the software to configure App permissions.Previously allowed permissions can be reset on Apps menu in device settings after software update.",http://lh3.googleusercontent.com/gk7K3EIR0yGHoEyu8hWQAI0UFs9NfYF0fFZaP1skYEnImNRkIrQIsdBlwRQ4AFZreGg=h900,http://lh3.googleusercontent.com/Sw0f3vncSxRbXJmdDcfQdAJfGq7A0s6I8nGzUtPTvnZ_AP6n76M3WccwI398L2-syzs=w300
23,com.sonymobile.lifelog,"Lifelog is the clever activity tracker app for Android that keeps track of what matters to you – like how many steps you take and how much you sleep – with or without a Smartband. You can set personal health goals, follow your progress and get insights into your behavior.Lifelog lets you look back on any day to see how active you were, where you went and how you got there. Log your day every day, in detail.This application uses analytics software to collect and aggregate statistics to help us improve this app and our services. None of this data can be used to identify you.",http://lh3.googleusercontent.com/V_hH4g2WIYwOdNEkLmzZoHzQD0_zi6qPDWNjW0p8qS3LUsATLbF03RIlginTwX9rWMo4=h900,http://lh3.googleusercontent.com/r-ZjUMj2jOP5gDYQ_S5DlQogvTxJRZ4P0KbPrmMjQAllPObd_GWG2yjf0N2SSofzO0ka=w300
24,com.mapmyrun.android2,"Achieve your fitness goals with MapMyRun. Effortlessly track and map over 600 types of workouts including running, walking, cycling, gym workouts & more. Whether you're looking to lose weight or training for your next marathon, MapMyRun is a fitness tracker that keeps up with you. Track your GPS-based workouts or connect and import data from any of the leading activity tracking devices in the industry including Android Wear. Join our community of over 40 million runners to share tips, motivation, and your own journey with pros and beginners alike.TRACK AND MAP YOUR WORKOUTS- Log over 600+ activities: running, cycling, walking, gym workouts, cross training, yoga, & more.- Audio feedback on every GPS-tracked run, with customizable voice feedback for stats like pace, route, distance, calories, and elevation.- Add your running shoes and track mileage with Gear Tracker to get notified when it’s time for a new pair to avoid injuries.- Use Routes to find nearby places to run, save your favorite paths, add new ones, and share them with others.- Connect and import data from over 400+ leading fitness apps and devices including Android Wear, Google Fit, UA Record Equipped Shoes, Garmin, Fitbit, Jawbone, MyFitnessPal, & more.JOIN THE COMMUNITY- See your friends' workout activity and always have someone there to motivate you. - Share your workouts on Facebook and Twitter.- Join Challenges to compete with others, climb the leaderboard, and win awesome prizes.TRAIN LIKE A PRO WITH MVP PREMIUM FEATURES- An ad-free experience with special features- Training Plans (e.g., 5K, 10K, Half Marathon, Marathon) that adapt dynamically to your fitness level as you improve to reach your running goals.- Monitor & analyze your Heart Rate zones & adjust your training based on your goal.- Stay on track with audio coach updates based on targets you set, including pace, distance, duration, calories & more.- Live Tracking to share your real-time running location and give loved ones peace of mind.- Additional premium features on MapMyRun.comIf you upgrade to a premium MVP subscription, payment will be charged to your Google Wallet account at confirmation of purchase. The monthly subscription costs USD $5.99 per month. The yearly subscription costs USD $29.99 per year, or USD $2.50 per month. Your subscription renews automatically unless canceled at least 24 hours prior to the end of the current period. There is no increase in cost when renewing.Subscriptions can be managed and auto-renewal turned off in Account Settings under ‘Subscriptions’ in the Google Play Store after purchase. Once purchased, the current period cannot be canceled. Any unused portion of a free trial period is forfeited if you choose to purchase a premium subscription to MVP.Find the full terms and conditions and our privacy policy at https://account.underarmour.com/privacy_and_terms.Note: Continued use of GPS running in the background can dramatically decrease battery life.MapMyRun is part of the world’s largest digital health & fitness community, Under Armour Connected Fitness, including UA Record, MapMyFitness, MyFitnessPal & Endomondo.",http://lh3.googleusercontent.com/axT287M6fy9bYrerc74Bd-6-vUJARu4m1SsBvnC3ISt9If_hyjUvkGpDBAxsiiuKugw=h900,http://lh3.googleusercontent.com/Rw6L8M-86xoxIP2YVIB66pqAd1Mht3nf0s2NintOyTm68FQ4Ac2UaigOrjBFqzhj1aw=w300
25,monitoryourweight.bustan.net,"Award Winning Weight Tracker App developed as a tool mainly to help motivate a person following a diet and/or exercise program to reach their desired target weight within a predefined period. * Winner of 7th Annual Best App Ever Awards under Health Category ** Best App developed in Kuwait - Annual Informatics Awards * As the name indicates, you will be able to enter your weight on a regular basis and monitor your progress accordingly through means of statistics and graphs. You may also enter and track multiple profiles as well - monitor the progress of your family members, spouse, friends, colleagues - or simply create more than 1 profile for yourself to set partial targets until you reach your ultimate goal. This app will also suggest your ideal weight and recommend the amount of time needed to reach that target based on your current weight, height, body frame, gender and age. You may, of course, choose to alter the suggested targets based on your own plans. Main Features: - Weight tracker with option to track single or multiple profiles - Track various body measurements- Option to synchronize your data between devices or to our server - Measurements may be represented in Kilos, Pounds, Stones, Meters or Feet - Calculates ideal weight based on age, height, gender and body frame - Full screen graph that shows your overall weight loss progress over time - BMI (Body Mass Index) calculated - Calculates daily calorie intake - Calculates percentage body fat - Total Weight Loss calculated - Remaining amount of weight calculated - Average Daily Loss calculated - Average Weekly Loss calculated - Overall progress calculated - Possibility to enter new weights at earlier dates - Displays an indicator to show the quality of your daily progress - PIN lock to secure your privacy - Multiple Language localization supporting over 15 languages - Possibility to export all your recorded data - Integration with digital scales: Withings, Aria, WiTراقب وزنك - حسين البستان - الكويت",http://lh3.googleusercontent.com/G-9Tv1qUSapnBNokl53O1dFEYuJhi0S9wPS0njvuHo53t66BehAysjwhHtRFMCQQRw=h900,http://lh3.googleusercontent.com/Ok4OGPfaHO6e0kZ6keowEkqNHcSwGCjt6yeREXgMNkKnHlzzCzCs6EQ1ae4ATd-8HLw=w300
26,com.sillens.shapeupclub,"Your personalized health and lifestyle guide. Lifesum takes your lifestyle goals and health data and creates a plan to help you live better. Whether you want to lose weight, gain weight, build muscles or just be healthier, join millions of people using one of the Google Play's best Health and Fitness apps and discover how changing your small, everyday habits can transform your life. *Editors' Choice 2016**Top Developer 2016* 1. Get a personalized roadmap to a healthier life based on our Life Score2. Build a healthy lifestyle that suits you and your needs 3. Learn how to eat wiser 4. Get exercise tips so you train better5. Get motivated6. See your progress7. Live healthier and happier8. Stay green with the Red Meat tracker Lifesum integrates with Google Fit and S Health, so you can export consumed water and food from Lifesum to Google Fit and S Health, and import fitness data, such as step counts and exercises, and weight to Lifesum. For extended features such as specialised diets and detailed nutrition information, and to sync with fitness apps such as Moves, Withings, FitBit, Jawbone, Endomondo and Runkeeper, get the Lifesum Premium membership.http://api.lifesum.com/mobile-terms",http://lh3.googleusercontent.com/3hjD0mmyttaPBNMPBZzpb29w7EB5X4ThLC6rknrenWgDoe-SBvfS0S7ezDaNS0gDAJA=h900,http://lh3.googleusercontent.com/ep8oRqpOFNePhMcd78nDtmMMD_ija7Bk--rHwiH98pU3vomT3KN-w_FNbOs01Cq_6A=w300
27,com.droid4you.application.wallet," Actively plan and manage your finances, together with the people you trust, across multiple currencies, banks, and financial institutions. Get and keep full control of your finances.  - Talk Android - Joy of Android - PloymintChuck your notebooks and spreadsheets, and budget for clear, tangible goals that are easy to track in real time. Wallet by BudgetBakers is not just an expense tracker or a money budgeting app. It’s all about getting things under control now, so that you can make wise decisions and plan for the future - a month, a year, or 10 years down the line. Wallet is designed to help you get your finances under control from day 1, giving you ongoing insight into your financial situation, and helping you stay in control for the long term. - Transactions are automatically and securely synced with your bank, smartly categorized, and factored into your budget. With 3,500 participating banks worldwide, you’ll save loads of time not having to track your money. - Budgets help you to plan for the future. Whatever it is you need to accomplish, from paying off debts, to buying a car or saving money for retirement, Wallet offers the flexibility to meet your goals, and smartly react to changing financial circumstances.  - Easy-to-understand graphs and financial overviews give you actionable insights about the state of your finances, across bank accounts, credit and debit cards, debts, and cash.  - Selected accounts can be shared with family, friends or colleagues who need to cooperate on a budget. Everyone can contribute from any platform, be it Android, iPhone or the Web. List of other features: Multiple currency support, Automatic cloud sync, Receipt and warranty tracking, Categories and templates, geo-mapping transactions, hash-tagging, Shopping lists, Exports to CSV/XLS/PDF, debt management, PIN security, Standing orders, notifications and much more.1. Download the app2. Sign In Via Facebook or Google3. Get going: budget and track expenses like a master! ",http://lh3.googleusercontent.com/4msBHtCO0lhwHUyWaT4e9Layqj9J5HEizr8E298jWjEurMNcHmv5rxZNH1f3t9AWLOM=h900,http://lh3.googleusercontent.com/LBIyqZbsxXWWQWjsWD5moPJhQQ5L0OKUFNNEbNfUAyJR8vBhPTNll4m2Z2-Lu6reuU4=w300
28,com.gmail.jmartindev.timetune,"This is what you can achieve with TimeTune, your routine schedule planner.Have you ever wondered how come some people seem to be able to do plenty of things in a single day while your time slips through your fingers?The answer is that they have a very sound and organized distribution of time. They use healthy routines and stick to them, allowing them to squeeze every available minute, create good habits and do everything in their schedule.With TimeTune, your routine schedule planner, you can do the same.★ Time management based on routines and suitable for everyone who values their time (workers, students, parents, freelancers...)★ Routines can be daily, weekly (the most common case), or use an odd number of days (for professions with unusual shifts), adding great flexibility to your routine schedule planner★ Routine schedules work like a calendar but you don't need to enter calendar dates★ Ability to design and send routine schedules for other people (useful for trainers, doctors or anyone who needs to craft routines and habits for others)★ Creation of attractive custom tags to quickly identify the activities in your schedule at a glance★ Full customization for each notification independently (vibrations, sound, personal message, popup window and even voice)★ Routine statistics to analyze and improve your distribution of time, so you can increase your productivity, do everything in your schedule and detect time leaks★ Reminders and Timers will allow you to schedule activities that don't quite fit in a routine: one-time activities, activities without duration or tasks with an odd repetition cycle★ Widget with a completely customizable look so that you can examine the activities in your schedule the way you preferYou can use TimeTune as a daily task reminder, student calendar, timetable planner, routine schedule organizer, productivity habit tool, daily time manager or daily planner. And it can be more convenient than a calendar for routine tasks, as it doesn't clutter your calendar schedule. We want TimeTune to be a powerful productivity tool for you, so if you like it don't hesitate to tell us what you'd like to add.Remember, don't be a slave of time, use the time to your advantage.But most of all... enjoy every minute!★ Routine Programmer: enable and disable your routines automatically on specific dates★ Calendar Sync: see your Google Calendar events on TimeTune★ Pro themes: Blue, Gray, Green and Pink themes combined with Light, Dark and Black Amoled backgrounds★ More Pro features will be added progressivelyIf you have any issues with the app, please check our troubleshooting page (http://timetune.center/troubleshooting/) or contact through email if you can't find an answer. Please don't leave a bad rating before asking for support. Thanks!TimeTune is still young and for that reason your support is crucial. If you like it and think it has a great potential please give us a nice review, it really helps.  But if you really don't, please tell us what you would like to change, we really want to know in order to improve. Web & Blog ► http://timetune.centerCommunity ► https://plus.google.com/u/0/communities/115980946943555967442Facebook ► https://www.facebook.com/timetuneappHelp Translate ► http://timetune.oneskyapp.com",http://lh3.googleusercontent.com/3-gm5Vh6cwKk8oOkYs7dwIVi_VAAkiCgJ9cFAGwUCLauF-qnAPKg3kUrqogpK_xbDg=h900,http://lh3.googleusercontent.com/qqy5XUhs76idJjtMH9mjrTyYgiKOHeYe947r4_3rCqupA6Sdjpif6K_Pm4lfKydkN-8=w300
29,tools.bmirechner,"Calculate your Body Mass Index (BMI) based on the relevant information on body weight, height, age and sex.Stay motivated by tracking your daily weight and analyze your progress in various charts and statistics. Also use the included handy calculators to determine your Waist-to-Height Ratio (WHtR), Body Fat Percentage and Calorie Consumption (BMR + PAL).Included features:• BMI calculation - classified by sex and different age ranges• Local storage to track your daily weight • Analyze your weight history in various charts and visualizations to gain insights on the way to a better body image • Set a desired target weight and follow your progress• Comprehensive statistics about your weight, i.e. your average weight or difference your starting and target weight.• A weight reminder that supports you to achieve your ideal weight • Input weights in the metric or imperial unit system • Sync your weight data with your Google Fit accountCheck your body stats to find your ideal weight, because overweight and obesity are risk factors for diseases such as hypertension, heart disease and diabetes. It can also be used to find your healthy weight if you want to lose weight or are on diet.More information about the BMI is available on the website of the World Health Organization (WHO).Please leave a ★★★★★-review if you like our app!Criticism, praise, problems with this app? Feel free to contact us via email: android@bmi.appovo.com",http://lh3.googleusercontent.com/05EP9exCNhPr6b4umw3n2Wu57JuGZ0ZRTjz89MNAX6TqcHsx6oxEhV6xaI7RmUYZog=h900,http://lh3.googleusercontent.com/owFK-rIjdMhPRYb2GW9evvP9eZoQlSYLp8kh4Jt6JF96mLmRa-O92Yn1EkuQJaFEfhE=w300
30,jp.co.recruit.mtl.beslim,"** Let's diet cleverly when we have an appetite! ** It’s easy to use. Just enter your values once a day. You can continue because it's simple! Now is the time to diet and lose body fat healthily! RecStyle will provide strong support for your beautiful figure and your health. ** Various functions to provide strong support for your diet! ** * You can easily customize the items you want to manage! With RecStyle you can add items indispensible for dieting, such as 'weight' and 'body fat', and you can also manage your 'muscle mass', useful for muscle training. In addition, you can easily add 'waist', 'BMI', 'all types of stamps (overate, exercise, drank too much, constipation, poor health, menstruating)', and 'text notes' with one touch from the input screen. * A detailed graph display that's easy to understand! When you've entered values such as your weight and body fat, try turning your device sideways. It will automatically change to a graph display, where you can check the change in your values as well as stamps and notes you've entered previously. In addition, you can check the average value for each 'week' or 'month' with the buttons on the upper left of the screen. * Stop forgetting to input with daily notifications! If you set the time that you usually weigh yourself, it will send a notification to stop you forgetting to input. In addition, every Sunday it will report the average change in weight for the week, allowing you to understand the progress of your dieting. * 5 colors to choose from! You can change the color to suit your tastes or your mood for that day, from five different colors: black, white, orange, green and pink. You can tackle your weight recording any time with a fresh attitude. * Of course it is also complete with basic functionality! Its basic functionality is also complete, such as a 'lock function' to protect the important weight management data that you don't want other people to know about, a 'target value display' on the graph display (it is possible to set the target value for 'weight', 'body fat', 'muscle mass' and 'waist') and much more. ** All these functions are free! And there are no advertisements at all! ** This is for all those who want to manage their weight, whether for diet or for muscle training.",http://lh4.ggpht.com/tfZAmKKG5cJ0EgwIBMCqO-FX_6zyILUm3U3QB4E5ZnS2WyKSfpTpfUdwPGSTTi3aMNQ=h900,http://lh4.ggpht.com/kQ8JQJGsF5jBNyle4BbOFCQh-saPiJWT9GQtZFZ6-Ji69w6hKVCADDnDcpcfbFJX3A=w300
31,com.dungelin.heartrate,"Check your heart rate anytime, anywhere with Heart Rate Plus - at your home or your office - when you wake up, relax, before and after exercise, or before a big meeting.Bet you never thought your phone or tablet could do that?The Heart Rate Plus app will measure your heartbeat with great accuracy, using your smartphone’s camera sensor and flashlight by processing the images of your pulse on your finger!Instant, accurate, and excellent for monitoring your health and fitness.FEATURES:✔ Fast and accurate measurement✔ Save result for access later✔ Real time pulse graph✔ Android Wear support: Measure your pulse using the heart rate sensor in your smartwatch. Automatically measure✔ Reminder: Automatic remind you to measure your heartbeat everyday✔ Export history to CSV file (ads free user only)✔ Built-in sensor support with device run Lollipop and later.USER GUIDE:Please read carefully before using this app.★ Hold the tip of your index finger over the back camera lens and flash of your phone or tablet.Do not press too hard or you will restrict circulation which will result in an inaccurate reading.★ After a second or two, you should see your heart pulse graph. Keep holding your finger still for five more seconds to compute your heart rate and update the number. For best results, hold your finger still for 10 seconds to get an accurate heart rate.Follow our official Facebook page: https://www.facebook.com/HeartRatePlusApp*** If you like this app, please support us, you can remove ads from the Menu*** We welcome your ideas and suggestions, please email us at: pvdapps.com@gmail.comWARNING: This app is not a medical product!",http://lh3.googleusercontent.com/9D9C5u9TQIqXvL6dN7Q0K5s4QiaA6QdOnElt0AvXQXZgKVBJJ4mBZoWcw63ilillBnh1=h900,http://lh3.googleusercontent.com/Bd8sv7Nuvk6AWwXoNulljMSV4tM897GyrZevUAes2MbFglfW_ilQTY-XMzZwJdAtBUtc=w300
32,com.soh,"Take the 30 day challenge and discover the secret of happiness. All you need to do is think positive and enter it into the app right after you get up in the morning and just before you hit the bed in the night. Repeating it for 30 days will train your brain to think positively and your subconscious mind will remain happy.Try it out for 30 days and share us your experiences. If you have any suggestions, comments or complaints about the app, do mail us at dev4playapps@gmail.com. We will be happy to hear you!Permissions used are only for displaying ads.Reviews-----------Listed in 50 Great Apps to Keep you in Tip-Top Condition! - http://drippler.com/samsung/galaxy_proclaim#!368086Listed in 17 Best (anti) Depression iPhone & Android Apps of 2013 - http://www.healthline.com/health-slideshow/top-depression-iphone-android-appsThe Best Depression iPhone & Android Apps of the Year of 2014 - http://www.healthline.com/health-slideshow/top-depression-iphone-android-apps#17",http:https://lh5.ggpht.com/RLhdcPEeoJQyVKajSL0fJLSqsoJN1cVdjIEdXsXoAoNf_wpcTpznrg5q1XjGf4fr_g=h900,http:https://lh6.ggpht.com/onCVtp_64LyAMRHSLxYI1BYx2SI-3DoqzJq7PStA2ttSo8TnA2WVmZX8hD5ZXk14EEga=w300
