,app,description,image,logo
41,com.stt.android,"Sports Tracker is not only one of the best fitness apps around, it’s the original sports app. For over a decade, Sports Tracker has helped millions of fitness fans around the world get inspired through exercise, and it can help you too -- whether it’s running, cycling, walking, hiking, mountain biking, skiing, or other sports activities that power your passion.Track your training using powerful GPS and maps, analyze everything from calories burned to average speed and altitude, and monitor your progress as you work towards your fitness goals. Best of all, you don’t have to go it alone! Sports Tracker is the social sports tracking application and service that started it all. Powerful social features let you share your workout progress and photos with friends and followers, motivating you to stay on track with your training.Sports Tracker for Android comes with powerful social features in addition to award-winning GPS tracking capabilities, making it the most feature-packed, easy to use fitness app available:• *Only phones with Android 4.4 or above, and if the phone has pedometer / step counter sensorTake your training to the next level with the Sports Tracker Bluetooth Heart Rate Monitor – available separately at http://shop.sports-tracker.com/Sports Tracker is the most powerful social sports tracking solution available for Android when used with the full-featured online service at www.sports-tracker.com.The free online service offers automatic workout backup, detailed maps and analysis views, friends' workouts and lots more.Ready to have fun getting fit so that you can be your personal best? Download Sports Tracker today and join the world’s first and the best social sports app community.",http://lh3.googleusercontent.com/hhlSOv2kSpIW4-YfB9SstgRNs3mHCx2Dqe3xz7ukxHVbFwJoo1a6nnmAfohkQUdhneY=h900,http://lh3.googleusercontent.com/bEpi2_wgewcgq6UG86rXVxgS3lu7GjR4w4W0FTK7siLvMQRYMADgQyFIptYLtrOowYI=w300
42,com.dietcoacher.sos,"√ Keep your motivation alive with inspiring tips, photos, good points and rewards√ The best weight loss tracker√ Lose weight fast and naturally and get into fitness by taking up small healthy lifestyle changes√ Way much more than just a calorie counter and a weight chartMy Diet Coach – Win the mental game of dieting!Join the thousands who already lose weight with My Diet Coach - You can do it too!*** So, how will My Diet Coach help you lose weight? ***My Diet Coach will help you find your inner motivation, help keep you on track, let you make healthy lifestyle changes and resist food cravings, emotional eating, avoid exercise laziness and other weight loss difficulties:•	Set your goal (We'll help you to achieve it)•	Track your progress (New! Visual weight tracker – See your lost weight ""drop off""…).•	Get reminders of what's important  (Your goal, motivational photos and reminders for your next exercise class)•	Take up small, healthy lifestyle changes - You'll never forget to drink water again!•	Boost your weight loss motivation with our inspiring tips, quotes,  good points and many other tools •	Be rewarded for your success - it's a lots of fun and super motivating✓ My Diet Coach is Inspiring and original with its colorful graphics - no other app is like it! That's why My Diet Coach was featured in top publications such as Forbes, The Next Web and CBS News.*** Your new life is just one tap away. You’ve got to try it – It's free! ***MORE DETAILS:We all know that in order to lose weight you just have to consume fewer calories than you burn. Sounds easy, doesn't it? But simply knowing this doesn't make losing weight any easier at all. While other apps might offer just a calorie counter or a weight chart,  My Diet Coach offers a full set of motivational and lifestyle changing tools:1. Customized reminders – Quickly boost your weight loss motivation and make small, healthier changes:   •	Remember your goal   •	Motivation - Pop-ups of your before and after photos   •	Drink water   •	Always be prepared with healthy snacks   •    Remember  your exercise class   •	Take a look at your weight chart    •	And much more!2. Visual weight tracker    •	The tracker is a fun, motivational and inspiring way to log your weight -  Visually see and track how much you've lost so far (Much better than a simple weight chart!)3. Daily challenges program which will help you to:    •	Be more active and improve your fitness - Take the stairs instead of the elevator; Do some squats before sitting down    •	Eat healthier and improve your nutrition - Keep your portion size down; Fill half of your plate with vegetables   •	Improve your self control - Avoid sugary drinks and high calorie fast foods; Avoid snacking in front of the TV•	Lose body fat and increase calorie burn•	Get “Healthy Lifestyle” points for your achievements4. Your motivation photos  •	To assist you in those moments of weakness  •	Before and after photos   •	Any other photo that motivates you5. Inspirational quotes and tips arranged by common weight loss challenges   •    Food cravings tips  •    Exercise laziness tips  •    Family meals tips  •    And many others!6. Get rewards – good points program, virtual fashion items   •   Get ""Healthy lifestyle"" points and virtual rewards for doing the right thing -  A really fun game-like experience!7. Customize your avatar with the virtual fashion items you get (for women only)  • It's fun, interactive and super motivating  • Game like experience8. Lose even more weight with My Diet Coach - Pro. By purchasing the Pro you can also get: • Food cravings panic button and panic tips •  Weight chart (In addition to the tracker) •  Body measurements chart  • Diet diary with calorie counter, exercise calorie burned and meals journal • Water consumption tracker •	    BMI calculator •	    More...",http://lh3.googleusercontent.com/zhQas3bC1WgupCBGW-KJswChglj0trlWuYhvPxdsUIXvc9jhclk6ICrN01IOPLnLHw=h900,http://lh6.ggpht.com/PdDWcU_6lPlgD4yWC5SoWOl-szqZlR92VKT-43kWWETBnMD5x6fEocCK2NuJrBnYJM8=w300
43,com.lib.cwmoney,"※※,CWMoney the best finance management software for Android,  free 、easy to record daily expense,income money.※CWMoney is a Finance Management Software for Android, This Free Version have almost full function, it's easy to using, if you feel this free program help you,please give it good rating on Market,It will keep us update it, thank you.※If you like it, Upgrade the Pro. Version now（special price $4.99 for limited time):https://market.android.com/details?id=com.lib.cwmoneyexQ: How to edit/delete account/transaction/balance etc?A: Long tap in the list to bring up popup menuCWMoney is a personal finance manager.- UI Theme Select- Shortcut,Widget for QuickTrack.- Multiple accounts - Multiple currency- Support GPS,Camera,Album,Voice,Calc.- Transfers and Account Exange Rate- Hierarchical categories with custom attributes- setMonth budgets- Catalog ,Subcatalog Append/Edit- Filtering and PieChart reporting- Data Export (Excel XML,CSV ) EX.- Backup Send to Dropbox , Gmail , FTP...*WARNING*Please DO BACKUP before any upgrade! It is not recommended to move CWMoney to SD card.*PERMISSIONS*PHONE STATE - used to forget find back your password.LOCATION - to stamp current location on a transactions, can be switched off in the preferencesINTERNET - for check update,and required by Google Maps component to edit/view locationsCAMERA - to attach pictures to transactions",http://lh3.googleusercontent.com/dKD8VcFhX2NQWTDWeuxwCMrTSKN9cPQAHL_HyqvnBmR6qeWLLZwj9A-0lnbdlONntQ=h900,http://lh3.googleusercontent.com/xPcOwWBvmzY-TSBd-xdtNQJIXQn9HYBaaqOCZdC6UR5uhgJ8HLkobk2SJGJWt7xzpQ=w300
44,com.runtastic.android.sleepbetter.lite,"Start tracking your sleep cycle and waking up feeling refreshed to the sounds of the Smart Alarm clock! Sleep Better is a sleep tracker and alarm clock all in the same app, it will track your sleep cycle and wake you up at the optimal time with the Smart Alarm clock feature. Whether you struggle to fall asleep, are interested in tracking the phases of your sleep cycle, want better sleep, or simply want some new alarm clocks sounds, Sleep Better will help you wake up ready to seize the day!Using our sleep monitor app you can track your sleep cycle and wake up at the right time for you with the smart alarm clock. A good night's sleep is all about good habits and optimising your sleeping environment for a better sleep. With our sleep tracker app you can see how long you slept with the sleep timer, analyse your sleep cycle and use this to monitor your sleep quality and see where you can improve our Sleep Better app.* Start your sleep app and simply set your device on your bed (next to your pillow). Plus, you can make use of all tracking features, even when in flight mode! * Track your sleep cycle and duration with the sleep timer* Develop a better understanding of your light sleep, deep sleep & time spent awake in bed, (when falling asleep or waking up in the morning)* Use the smart alarm clock to wake up at the ideal time during a sleep cycle* Enjoy a variety of alarm clock sounds and snooze functionality for a perfect, personalised start to your day* Enter daily habits & variables, such as caffeine consumption, exercise info, alcohol consumption and stress level, to determine the effects of these variables on your sleep quality* Monitor moon phases and see if this affects your sleep* Keep a dream diary to learn what you dream about most and what percentage of your dreams are good, bad or neutral* Note your moods as part of your daily stats upon waking up* View sleep history - your personal sleep tracking log - within a clean, modern app design, including daily stats and overviews for longer time periods (i.e. a selected week or month)* Filter history taking daily variables into account to determine when you’re sleeping best* Compatible with tablets* Share your sleep sessions via Google+, Facebook, Twitter, WhatsApp & email* Some functions & benefits are limited in the free version of Sleep Better. To access all benefits, users are encouraged to take advantage of the Sleep Better in-app purchase.What are you waiting for? Download this simple, yet functional, sleep tracker and smart alarm today and start getting better sleep! If you’d like even more information on why sleep is such an important part of your overall health, wellness and fitness efforts then visit the Runtastic Blog today to read our sleep series.Sleep Better with Runtastic: Because great nights lead to great days!",http://lh3.googleusercontent.com/hPuvYhsF_QNftMh4_RcTTev5u9i-pHNb-SQphoYszhbMmYVZUDY3oUAHaCEVGbvC4F4=h900,http://lh3.googleusercontent.com/SquyoaP_43X5X45YmT9ihnLuDIPEvKke9Vq5rSu3Y3OiOjW6yWC7jHYPX3Gs4xnperdb=w300
45,com.runtastic.android.pedometer.lite,"The Runtastic Pedometer Step Counter app is a simple, yet feature packed step counter app and turns your phone into your own personal step tracker. It will also show the duration, calories burned and walking distance. The app will also continue to count your steps if it's placed in your pocket or bag. Start our pedometer app with one tap and get moving!APP FEATURES & BENEFITS: (limited in free version)* Automatic step counting (even if your phone is in your pocket, bag etc)* Accurate calculation of calories burned* Calculates speed & distance* Steps per minute counter* Training and activity log including analysis* Overall stats of all your walking activities* Share your activities on Social Media like Google+, Facebook, Twitter, WhatsApp and many more* Sync with Runtastic.com: Manage all data online* Users can save body metrics like weight and height for a more accurate calorie countRuntastic Pedometer and Step Counter is the ideal step tracker app to stay motivated to walk more, rack up more steps and walk greater distances by foot. Our Pedometer app helps you reach the recommended 10,000 steps per day. Kick off your journey towards a fitter, healthier self!April 2016Runtastic Pedometer Step Counter is a simple, yet feature packed, app that will track the number of steps you take using just your phone. It will also show the duration, distance, and calories burned during your walking. The app will also continue to work if it's placed in your pocket or bag. Start the pedometer with one tap and get moving!APP FEATURES & BENEFITS: (limited in free version)* Automatic step detection (even if your phone is in your pocket, bag etc)*  Accurate calculation of calories burned* Calculates speed & distance* Steps per minute counter* Training and activity log including analysis* Overall stats of all your activities* Share your activities on Social Media like Google+, Facebook, Twitter, WhatsApp and many more* Sync with Runtastic.com: Manage all data online* Users can save body metrics like weight and height for a more accurate calorie countRuntastic Pedometer and Step Counter is the ideal way to track your steps and to stay motivated to walk more, rack up more steps and walk greater distances by foot. Our Pedometer app helps you reach the recommended 10,000 steps per day. Kick off your journey towards a fitter, healthier self!",http://lh4.ggpht.com/Xy7tReZroOxecE1uA2iKh5QPa3sipQKcoWUFF-9GGJk4UxyZpRaF0f6uX1Ff9s-mjr8=h900,http://lh5.ggpht.com/FKQnEUw4loHIcDMtUPa9erc5Rg6azRXETgtz3QR7jR2tedyHLF2hYWsmZ0sTsVN16Q=w300
46,com.mapmyride.android2,"Map My Ride – GPS Cycling, Riding, Mountain Biking, Workout Tracking and Calorie CounterStart riding with the MapMyRide community. Record GPS-based activities to view detailed stats; connect with 400+ devices to import and analyze all your data in one place; log over 600 different activity types. New Android Wear app allows you to start tracking and keep an eye on your progress all from your wrist.ALL THE FEATURES YOU NEED TO SUCCEED☆ Gear Tracker - Add your athletic shoes and start tracking mileage with Gear Tracker. Help yourself avoid common injuries and get notified when it’s time for a new pair.☆ 600+ Activities - Log and record workouts with the largest selection of activities, including running, cycling, walking, gym workouts, cross training, yoga and tons of others.☆ Workout Stats - Record GPS-based workouts with customizable voice feedback for precise stats like pace, route, distance, calorie burn, elevation profile and more.SHARE FITNESS & NUTRITION DATA☆ Share Data - Sync your account with other health and nutrition apps like MyFitnessPal and Google Fit. TRAIN LIKE A PRO WITH MVP MEMBERSHIP☆ Go MVP - Be a premium member for an ad-free experience and access special features like heart rate analysis, personal training plans, audio coaching, and Live Tracking.☆ MVP Members Only - Enjoy exclusive offers and promotions from our partners.JOIN THE COMMUNITY ☆ Activity Feed - Share your progress and see what friends are doing on your Activity Feed. Whether you’re a beginner, casually active, looking to rededicate yourself to fitness or an athletic enthusiast, you’ll fit in perfectly with our 30+ million member strong community.☆ Social - Share your progress and workouts with friends on social media.MORE FEATURES ON THE WEB☆ 24/7 Activity Graph - Connect devices to view steps, sleep, workouts and more, all in one expertly designed graph. ☆ Import Data - We make it easy to connect and import data from the best activity tracking devices in the industry. Connect devices from Jawbone, Misfit, Fitbit, Garmin, Withings and more (Bluetooth Smart™ and ANT+™).☆ Challenges - Join Challenges for some friendly, virtual competition, climb the leaderboards and win prizes.Be sure to visit us at www.MapMyFitness.com for the full experience.Should you choose to upgrade to MVP, payment will be charged to your Google Wallet account at confirmation of purchase. The monthly subscription costs USD 5.99 per month while the yearly subscription costs USD 29.99 per year or USD 2.50 per month. Subscription renews automatically unless cancelled at least 24 hours prior to the end of the current period. There is no increase in cost when renewing. Subscriptions can be managed and auto-renewal turned off on wallet.google.com and click on ‘Update or cancel your subscription’ on the Transactions page after purchase. Once purchased, the current period cannot be cancelled. Any unused portion of a free trial period is forfeited if you choose to purchase a subscription to MVP. Find the full terms and conditions, and our privacy policy, at http://www.mapmyfitness.com/terms_of_use and http://about.mapmyfitness.com/about/user-privacy-policy/ respectively.",http://lh3.googleusercontent.com/rLIQbDtmxbijM2hZMDbIceXJyDT5ez2pDNWM6bMbvfOLIiaQL3RITRvk47b-cINa2oKr=h900,http://lh3.googleusercontent.com/QFnJOdLjLxgRLGEZ6Btr9DYT2d-GqaQOyty-e2hzv0Q9RHXbLfbPPYF4bhHooOqAcwI=w300
47,com.expensemanager,"Looking for an expense and budget tool? Stop searching. Expense Manager is simple, intuitive, stable and feature-rich app that is just designed for you. Everything you need at your fingertips to manage the expenditures, checkbook and budgets. 100% FREE – full features, no hidden charges or in-app purchases by Bishinews, a top rated developer by Google.• Tracking expenses and incomes• Split Transaction - Record all items in a single transaction with different category and amount• Recurring expense and income• Multiple accounts• Taking a picture of receipt• Tracking tax• Tracking mileage• Tracking debts• Credit Card• Credit Card and bank SMS message parsing• Write, Print, and Email Checks • Organizing bills by week, month and year as well as by categories• Schedule the payments and recurring payments• Payment alerts• Daily, weekly, monthly, and yearly budget with progress bar• Daily, weekly, monthly, and yearly summary• Calendar view for expense and income• Calendar budget forecasting• Search by category, subcategory, payee/payer, payment method, status, description, tag, etc.• Reports in HTML, CSV, Excel and PDF• Import and export account activities• Charts by category, subcategory, payee/payer, payment method, status, description, tag, date etc.• Email report for print• Automatic backup on Dropbox, Google Drive and SD Card• Automatic sync between devices via Dropbox• Currency converter • Regular calculator• Tip calculator• Loan calculator• Credit card payoff calculator• Interest calculator• Note• Shopping list• User can easily customize background color, action bar color and button color.• Customizing date format• Customizing category and subcategory• Payment method, payee/payer, Tags, income category and status can be entered or updated by user• Multiple currencies support• English• German• French• Spanish• Portuguese• Russian• Italian• Turkish• Indonesian• Chinese (Simplified)• Chinese (Traditional)• Widgets: overview, summary, budget, calculator, quick add etc.• PIN protection • No registration and internet access are required.• Active developer supportNo other app can beat us on features. It's all free.PERMISSIONS EXPLANATION:• Storage: backup data in sdcard and external storage. Save purchase receipt in sdcard and external storage.• GET_ACCOUNTS: back up data on Google Drive.• SMS: Parse SMS message from your credit card and bank and save it automatically in the app. If you don't use this feature, go to phone Settings/Apps/Expense Manager/Permissions to switch off SMS permission on phones with Android 6 and up. All data save on your phone or your personal cloud account. Nobody but you can access your account.Thanks for the help from:Emilio Blanco for Spanish translation. Christian Glass and Manuel Gruber for German translation.Michel Graciano, Gustavo de Freitas Leite and Ricardo Gomes for Portuguese translationCerrato Renaud for French translationKey words: Expense Manager, Expense Tracker, Money Manager, Money Tracker, Budget Tracker, Spending Tracker, Budget Manager, Budget Planner, Checkbook, Finance Manager, Daily Expense, Home BudgetPlease email question and feature request directly to developer at pfinanceapp@gmail.com. We actively support users.",http://lh3.googleusercontent.com/mjurG9GPc420IZjBK44pHAuKLbPn4D1PDSAWkvgaVkZCAB24TnFA7WQ_LeN7cXuXXRE=h900,http://lh3.googleusercontent.com/DuociTkA2k_hEo2k5fvBqGPAKLROAYDVEVmhj32A-i7GoBo7bxQl72cW5keyYuW-PQXb=w300
48,com.intuit.quickbooks,"Perfect for small business owners that need accounting or payroll. A mobile and desktop solution to manage your finances on-the-go and get paid faster. Save time and run your business efficiently.See Dashboard business insights at a glance• View your Profit and Loss reports to know what you’re making and spending. • See expenses by category.• View all your open and overdue invoices.• See today’s account balances on the go.INVOICE YOUR CLIENTS AND GET PAID FROM ANYWHERE• Create and send professional invoices and quotes.• Create and send professional quotes and invoices to your customers.• Keep cash flowing by sending customised Invoices for instant payment online.• Receive notifications when invoices have been viewed and paid.MANAGE EXPENSES, SALES, AND CUSTOMERS ON THE GO• Take photos of receipts and attach them to expenses for maximum tax savings.• Connect your bank accounts, so you can get a closer look at your Profit and Loss to see where you’re making and spending money.• Profit & Loss and Balance Sheet reports show how your small business is doing.• Review your bank transactions and add them to your books.• Receive overdue invoice notifications so you always know who owes you money.• Add new customers and get ready for more business.GET PAID FASTER• Create a professional quote for your customers.• Send customised Invoices for instant payment online.• Receive notifications when invoices have been viewed and paid.TRACK BUSINESS EXPENSES• Record business expenses on the go.• Upload a photo of your receipt; it’s that easy to go paperless.• Categorise your expense, helping you reduce ﬁnancial admin at tax time.DO EVEN MORE ON THE WEB• Customise all your sales forms with your logo and fields—in minutes• Give your accountant access so you can collaborate and be better prepared for tax-time• Add additional features with over 80 partner apps, including inventory management and advanced CRM, using apps.intuit.com.IT’S EASY TO GET STARTED• Already use QuickBooks Online? Download the app for FREE and sign-in with your QuickBooks credentials• New to QuickBooks Online? Download the app, create an account, and try it FREE for 30 days. No credit card required, and no obligation to purchase. • Your FREE trial includes unlimited access to QuickBooks on the web, your phone, and tablet. • If you love it, subscribe right from your mobile device.SUBSCRIBE IN THE APPAfter your free trial, pricing is based on the country you select during account creation. Payment will be charged to your account at confirmation of purchase. Subscription automatically renews unless auto-renew is turned off at least 24-hours before the end of the current period. Subscriptions may be managed by the user and auto-renewal may be turned off by going to the user's Account Settings after purchase. No cancellation of the current subscription is allowed during active subscription period. Any unused portion of a free trial period, if offered, will be forfeited when the user purchases a subscription to that publication.Run your entire business with the No. 1 small business cloud accounting solution! Try it FREE for 30 days and enjoy the freedom to manage your small business anywhere from your phone and tablet, plus unlimited access to QuickBooks on the web. WHAT YOU NEED• QuickBooks Online users – it’s FREE with your subscription. Just sign in and go!• Note: You must be running 4.1 Android OS or later. Not compatible with QuickBooks Desktop for Windows or Mac.FROM INTUIT, MAKERS OF• QuickBooks Online & QuickBooks Self EmployedVISIT• https://security.intuit.com/privacy to learn how Intuit protects your privacy.• https://qbo.intuit.com/c1/Terms_Of_Service.html to read the Intuit terms of service.",http://lh3.googleusercontent.com/dWCJR5SH9dKbfcl-Ps_VC9BUOqPQb6iYN7vVjFgf-oYMZe7G5y5PoFyix1JLGo63nR8=h900,http://lh3.googleusercontent.com/lbVGUMmkR1JjtUR9HED0ZvSikK7k10FDdhOQdb82Hvzv0xmyXVeAzaghfS77UMU5cg=w300
49,arproductions.andrew.worklog,"Work Log is a ,  and  way to keep track of your shifts and calculate the number of hours worked and wages paid over your pay period. ★ ★ Save time with features like automatic break deduction and pay period settings★ Use widgets to punch in and out quickly, or as a shortcut to add a new shift. (tap on the punch in time to cancel it)★ Punch In and out, or enter your hours manually★ Customize how Work Log looks with options like date and time formatting, when your week starts and a light or dark theme★ View your hours in a variety of ways such as by week, month, pay period or all of your shifts at once★ Set your pay period to automatically calculate how many hours you worked and your wages for each paycheck★ Track as many details as you want with a variety of tracking options like Expenses, Tips, Sales, Mileage, Holiday Pay and more★ Have deductions and/or bonuses automatically calculated for paycheck estimates★ Keep track of overtime hours and wages for up to two separate overtimesInstall with Work Log Pro for extra features like tracking multiple jobs, removing ads, exporting all data as a spreadsheet (.CSV), as well as backup and import all saved data as a database via email",http://lh3.googleusercontent.com/TBseY9yJ9CAtYOFxCJwKi2C7_ACJRt2ummOJ96EE-RfMvLsll_QPwSRy7xiaROMI2Jg=h900,http://lh3.googleusercontent.com/S583YFaZL41wyqVyhbaUv-CWkkxonXXXXcOyMI7H0TNURIAaClYtSVpV3f1_xVEQPHM=w300
